Type,Scalar,Curative,Techative,Revive,StatusesAdded,StatusRemoved,AimType,Cost,Description
GreenHerb,30,True,False,False,[],[],[AllyAim True],10,Restaure un peu de PV.
RedHerb,100,True,False,False,[],[],[AllyAim True],50,Restaure une franche quantite de PV.
GoldHerb,999,True,False,False,[],[],[AllyAim True],200,Restaure tous les PV.
Remedy,15,True,False,False,[],[Poison Silence Sleep Confuse [Time false] [Power False False] [Power False True] [Magic False False] [Magic False True] [Shield False False] [Shield False True]],[AllyAim True],25,Restaure le statut et une once de PV.
Ether,30,True,True,False,[],[],[AllyAim True],50,Restaure peu de TP.
HighEther,60,True,True,False,[],[],[AllyAim True],150,Restaure une franche quantite de TP.
TurboEther,99,True,True,False,[],[],[AllyAim True],500,Restaure tous les TP.
Revive,30,True,False,True,[],[],[AllyAim False],50,Ranime un combattant evanoui.
